no,id,err1,err2,err3,err4,err5,err6,err7,err8,err9
0,1.1.1,"정보보호 및 개인정보보호 정책서에 분기별로 정보보호 및 개인정보보호 현황을 경영진에게 보고하도록 명시하였으나, 장기간 관련 보고를 수행하지 않은 경우","중요 정보보호 활동(위험평가, 위험수용수준 결정, 정보보호대책 및 이행계획 검토, 정보보호대책 이행결과 검토, 보안감사 등)을 수행하면서 관련 활동관련 보고, 승인 등 의사결정 에 경영진 또는 경영진의 권한을 위임받은 자가 참여하지 않았거나 관련 증적이 확인되지 않는 경우",,,,,,,
1,1.1.2,정보통신망법에 따른 정보보호 최고책임자 지정 및 신고 의무 대상자임에도 불구하고 정보보호 최고책임자를 지정 및 신고하지 않은 경우,개인정보 보호법을 적용받는 민간기업이 개인정보 처리업무 관련 임원이 존재함에도 불구하고 부서장을 개인정보 보호책임자로 지정한 경우,조직도상에 정보보호 최고책임자 및 개인정보 보호책임자를 명시하고 있으나 인사발령 등의 공식적인 지정절차를 거치지 않은 경우,,,,,,
2,1.1.3,"정보보호 및 개인정보보호 위원회를 구성하였으나, 임원 등 경영진이 포함되어 있지 않고 실무부서의 장으로 구성되어 있어 조직의 중요 정보 및 개인정보 보호에 관한 사항을 결정 할 수 없는 경우","내부 지침에 따라 중요 정보처리부서 및 개인정보처리부서의 장(팀장급)으로 구성된 정보보호 및 개인정보보호 실무협의체를 구성하였으나, 장기간 운영 실적이 없는 경우","정보보호 및 개인정보보호 위원회를 개최하였으나 연간 정보보호 및 개인정보보호 계획 및 교육계획, 예산 및 인력 등 정보보호 및 개인정보보호에 관한 주요 사항이 검토 및 의사결정 되지 않은 경우",,,,,,
3,1.1.4,"정보시스템 및 개인정보처리시스템 개발업무에 관련한 개발 및 시험 시스템, 외주업체직원, PC, 테스트용 단말기 등이 관리체계 범위에서 누락됨","정보보호 및 개인정보보호 관리체계 범위로 설정된 서비스 또는 사업에 대하여 중요 의사결정자 역할을 수행하고 있는 임직원, 사업부서 등의 핵심 조직(인력)을 인증범위에 포함하지 않은 경우","인증범위 내 조직 및 인력에 적용하고 있는 보안시스템(PC보안, 백신, 패치 등)을 인증범위에서 배제하고 있는 경우",정보통신망법에 따른 정보보호 관리체계 의무대상자 임에도 불구하고 인터넷에 공개되어 있는 일부 웹사이트가 관리체계 범위에서 누락된 경우,,,,,
4,1.1.5,"내부 규정에 따르면 정보보호 및 개인정보보호 정책서 제·개정 시에는 정보보호 및 개인정보보호 위원회의 의결을 거치도록 하고 있으나, 최근 정책서 개정 시 위원회에 안건으로 상정하지 않고 정보보호 최고책임자 및 개인정보 보호책임자의 승인을 근거로만 개정한 경우","정보보호 및 개인정보보호 정책 및 지침서가 최근에 개정되었으나, 해당 사항이 관련 부서 및 임직원에게 공유 전달되지 않아 일부 부서에서는 구버전의 지침서를 기준으로 업무를 수행하고 있는 경우","정보보호 및 개인정보보호 정책 및 지침서를 보안부서에서만 관리하고 있고 임직원이 열람할 수 있도록 게시판, 문서 등의 방법으로 제공하지 않는 경우",,,,,,
5,1.1.6,"정보보호 및 개인정보보호 조직을 구성하는데, 분야별 전문성을 갖춘 인력이 아닌 정보보호 관련 또는 IT 관련 전문성이 없는 인원으로만 보안인력을 구성한 경우","개인정보처리시스템의 기술적, 관리적 보호조치의 요건을 갖추기 위한 보안 솔루션 등의 비용을 최고경영자가 지원하지 않고 법적 위험을 수용하고 있는 경우",인증을 취득한 이후에 인력과 예산 지원을 대폭 줄이고 기존 인력을 타부서로 배치하거나 일부 예산을 다른 용도로 사용하는 경우,,,,,,
6,1.2.1,"정보보호 및 개인정보보호 관리체계 범위 내의 자산 목록에서 중요정보 취급자 및 개인정보취급자 PC를 통제하는데 사용되는 출력물 보안, 문서암호화, USB매체제어 등의 내부정보 유출통제 시스템이 누락되어 있는 경우",정보보호 및 개인정보보호 관리체계 범위 내에서 제3자로부터 제공받은 개인정보가 있으나 해당 개인정보에 대한 자산 식별이 이루어지지 않은 경우,내부 지침에 명시된 정보자산 및 개인정보 보안등급 분류 기준과 자산관리 대장의 분류기준이 일치하지 않은 경우,,,,,,
7,1.2.2,관리체계 범위 내 주요 서비스의 업무 절차-흐름 및 현황에 문서화가 이루어지지 않은 경우,개인정보 흐름도를 작성하였으나 실제 개인정보의 흐름과 상이한 부분이 다수 존재하거나 중요한 개인정보 흐름이 누락되어 있는 경우,최초 개인정보 흐름도 작성 이후에 현행화가 이루어지지 않아 변화된 개인정보 흐름이 흐름도에 반영되지 않고 있는 경우,,,,,,
8,1.2.3,"수립된 위험관리계획서에 위험평가 기간 및 위험관리 대상과 방법이 정의 되어 있으나, 위험관리 수행 인력과 소요 예산 등 구체적인 실행계획이 누락되어 있는 경우","전년도에는 위험평가를 수행하였으나, 금년도에는 자산의 변경이 없었다는 사유로 위험 평가를 수행하지 않은 경우","위험관리 계획에 따라 위험 식별 및 평가를 수행하고 있으나, 범위 내 중요 정보자산에 대한 위험 식별 및 평가를 수행하지 않았거나 정보보호 관련 법적 요구 사항 준수여부에 따른 위험을 식별 및 평가하지 않은 경우",위험관리 계획에 따라 위험 식별 및 평가를 수행하고 수용 가능한 목표 위험수준을 설정하였으나 관련 사항을 경영진(정보보호 최고책임자 등)에 보고하여 승인받지 않은 경우,,,,,
9,1.2.4,정보보호 및 개인정보보호 대책에 대한 이행계획은 수립하였으나 정보보호 최고책임자 및 개인정보 보호책임자에게 보고가 이루어지지 않은 경우,위험감소가 요구되는 일부 위험의 조치 이행계획이 누락되어 있는 경우,이행계획 시행에 대한 결과를 정보보호 최고책임자 및 개인정보 보호책임자에게 보고하였으나 일부 미이행된 건에 대한 사유 보고 및 후속 조치가 이루어지지 않은 경우,,,,,,
10,1.3.1,정보보호 및 개인정보보호 대책에 대한 이행완료 결과를 정보보호 최고책임자 및 개인정보 보호책임자에게 보고하지 않은 경우,"위험조치 이행결과보고서는 ‘조치 완료’로 명시되어 있으나, 관련된 위험이 여전히 존재하거나 이행결과의 정확성 및 효과성이 확인되지 않은 경우",전년도 정보보호대책 이행계획에 따라 중장기로 분류된 위험들이 해당년도에 구현이 되고 있지 않거나 이행결과를 경영진이 검토 및 확인하고 있지 않은 경우,,,,,,
11,1.3.2,정보보호대책을 마련하여 구현하고 있으나 관련 내용을 충분히 공유·교육하지 않아 실제 운영 또는 수행 부서 및 담당자가 해당 내용을 인지하지 못하고 있는 경우,,,,,,,,
12,1.3.3,정보보호 및 개인정보보호 관리체계 운영현황 중 주기적 또는 상시적인 활동이 요구되는 활동 현황을 문서화하지 않은 경우,"정보보호 및 개인정보보호 관리체계 운영현황에 대한 문서화는 이루어졌으나, 해당 운영현황에 대한 주기적인 검토가 이루어지지 않아 월간 및 분기별 활동이 요구되는 일부 정보보호 및 개인정보보호 활동이 누락되었고 일부는 이행 여부를 확인할 수 없는 경우",,,,,,,
13,1.4.1,"정보통신망법 및 개인정보 보호법이 최근 개정되었으나, 개정사항이 조직에 미치는 영향을 검토하지 않았으며 정책서 및 시행문서에도 해당 내용을 반영하지 않아 정책서 및 시행문서의 내용이 법령의 내용과 일치하지 않은 경우","조직에서 준수해야 할 법률이 개정되었으나, 해당 법률 준거성 검토를 1년 이상 수행하지 않은 경우",법적 준거성 준수 여부에 대한 검토가 적절히 이루어지지 않아 개인정보 보호법 등 법규 위반 사항이 다수 발견된 경우,,,,,,
14,1.4.2,관리체계 점검 인력에 점검 대상으로 식별된 전산팀 직원이 포함되어 있어 점검의 독립성이 훼손된 경우,"금년도 관리체계 점검을 실시하였으나, 점검범위가 일부 영역에 국한되어 있어 정보보호 및 개인정보보호 관리체계 범위를 충족하지 못한 경우",관리체계 점검 시 발견된 문제점에 대하여 조치계획을 수립하지 않았거나 조치 완료여부를 확인하지 않은 경우,,,,,,
15,1.4.3,내부점검을 통해 발견된 정보보호 및 개인정보보호 관리체계 운영상의 문제점이 매번 동일하게 반복되어 발생되는 경우,"내부 규정에는 내부점검 시 발견된 문제점에 대해서는 근본원인에 대한 분석 및 재발방지대책을 수립하도록 되어 있으나, 최근에 수행된 내부점검에서는 발견된 문제점에 대하여 근본원인 분석 및 재발방지 대책이 수립되지 않은 경우","관리체계 상 문제점에 대한 재발방지 대책을 수립하고 핵심성과지표를 마련하여 주기적으로 측정하고 있으나, 그 결과에 대해 경영진 보고가 장기간 이루어지지 않은 경우",,,,,,
16,2.1.1,지침서와 절차서 간 패스워드 설정 규칙에 일관성이 없는 경우,"정보보호 활동(정보보호 교육, 암호화, 백업 등)의 대상, 주기, 수준, 방법 등이 관련 내부 규정, 지침, 절차에 서로 다르게 명시되어 일관성이 없는 경우","데이터베이스에 대한 접근 및 작업이력을 효과적으로 기록 및 관리하기 위해 DB 접근통제 솔루션을 신규로 도입하여 운영하고 있으나 보안시스템 보안 관리지침 및 데이터베이스 보안 관리지침 등 내부 보안지침에 접근통제, 작업이력, 로깅, 검토 등에 관한 사항이 반영되어 있지 않은 경우","개인정보보호 정책이 개정 되었으나 정책 시행 기준일이 명시되어 있지 않으며, 관련 정책 의 작성일자 작성자 및 승인자 등이 누락되어 있는 경우","개인정보 보호 관련 법령, 고시 등에 중대한 변경사항이 발생하였으나 이러한 변경이 개인 정보보호 정책 및 시행문서에 미치는 영향을 검토하지 않았거나 변경사항을 반영하여 개정 하지 않은 경우",,,,
17,2.1.2,"내부 지침 및 직무기술서에 정보보호 최고책임자, 개인정보 보호책임자 및 관련 담당자의 역할과 책임을 정의하고 있으나 실제 운영현황과 일치하지 않는 경우","정보보호 최고책임자 및 관련 담당자의 활동을 주기적으로 평가할 수 있는 목표, 기준, 지표 등의 체계가 마련되어 있지 않은 경우","내부 지침에는 부서별 정보보호 담당자는 정보보호와 관련된 KPI를 설정하여 인사평가 시 반영하도록 되어 있으나, 부서별 정보보호 담당자의 KPI에 정보보호와 관련된 사항이 전혀 반영되어 있지 않은 경우","정보보호 최고책임자 및 개인정보 보호책임자가 지정되어 있으나, 관련 법령에서 요구하는 역할 및 책임이 내부 지침이나 직무기술서 등에 구체적으로 명시되어 있지 않은 경우",,,,,
18,2.1.3,"내부 지침에 따라 문서에 보안등급을 표기하도록 되어 있으나, 이를 표시하지 않은 경우","정보자산별 담당자 및 책임자를 식별하지 않았거나, 자산목록 현행화가 미흡하여 퇴직, 전보 등 인사이동이 발생하여 주요 정보자산의 담당자 및 책임자가 변경되었음에도 이를 식별하지 않은 경우",식별된 정보자산에 대한 중요도 평가를 실시하여 보안등급을 부여하고 정보 자산목록에 기록하고 있으나 보안등급에 따른 취급절차를 정의하지 않은 경우,,,,,,
19,2.2.1,"주요 직무자 명단(개인정보취급자 명단, 비밀정보관리자 명단 등)을 작성하고 있으나 대량의 개인정보 등 중요정보를 취급하는 일부 임직원(DBA, DLP 관리자 등)을 명단에 누락한 경우","주요 직무자 및 개인정보취급자 목록을 관리하고 있으나, 퇴사한 임직원이 포함되어 있고 최근 신규 입사한 인력이 포함되어 있지 않는 등 현행화 관리가 되어 있지 않은 경우",부서 단위로 개인정보취급자 권한을 일괄 부여하고 있어 실제 개인정보를 취급할 필요가 없는 인원까지 과다하게 개인정보취급자로 지정된 경우,"내부 지침에는 주요 직무자 권한 부여 시에는 보안팀의 승인을 득하고 주요 직무에 따른 보안서약서를 작성하도록 하고 있으나, 보안팀 승인 및 보안서약서 작성 없이 등록된 주요 직무자가 다수 존재하는 경우",,,,,
20,2.2.2,조직의 규모와 인원이 담당자별 직무 분리가 충분히 가능한 조직임에도 업무의 편의성만을 사유로 내부 규정으로 정한 직무분리 기준을 준수하고 있지 않는 경우,"조직의 특성상 경영진의 승인을 득한 후 개발과 운영 직무를 병행하고 있으나, 직무자간의 상호 검토, 상위관리자의 주기적인 직무수행 모니터링 및 변경 사항 검토·승인, 직무자의 책임추적성 확보 등의 보완통제 절차가 마련되어 있지 않은 경우",,,,,,,
21,2.2.3,"신규 입사자에 대해서는 입사 절차상에 보안서약서를 받도록 규정하고 있으나, 최근에 입 사한 일부 직원의 보안서약서 작성이 누락된 경우","임직원에 대해서는 보안서약서를 받고 있으나, 정보처리시스템에 직접 접속이 가능한 외주 인력에 대해서는 보안서약서를 받지 않는 경우",제출된 정보보호 및 개인정보보호 서약서를 모아 놓은 문서철이 비인가자가 접근 가능한 상태로 사무실 책상에 방치되어 있는 등 관리가 미흡한 경우,개인정보취급자에 대해 보안서약서만 받고 있으나 보안서약서 내에 비밀유지에 대한 내용만 있고 개인정보보호에 관한 책임 및 내용이 포함되어 있지 않은 경우,,,,,
22,2.2.4,전년도에는 연간 정보보호 및 개인정보보호 교육 계획을 수립하여 이행하였으나 당해년도에 타당한 사유 없이 연간 정보보호 및 개인정보보호 교육 계획을 수립하지 않은 경우,"연간 정보보호 및 개인정보보호 교육 계획에 교육 주기와 대상은 명시하고 있으나 시행일정, 내용 및 방법 등의 내용이 포함되어 있지 않은 경우",연간 정보보호 및 개인정보보호 교육 계획에 전 직원을 대상으로 하는 개인정보보호 인식교육은 일정 시간 계획되어 있으나 개인정보 보호책임자 및 개인정보 담당자 등 각 직무별로 필요한 개인정보보호관련 교육 계획이 포함되어 있지 않은 경우,"정보보호 및 개인정보보호 교육 계획서 및 결과 보고서를 확인한 결과, 인증범위 내의 정보자산 및 설비에 접근하는 외주용역업체 직원(전산실 출입 청소원, 경비원, 외주개발자 등)을 교육 대상에서 누락한 경우","당해 연도 정보보호 및 개인정보보호 교육을 실시하였으나 교육시행 및 평가에 관한 기록(교육자료, 출석부, 평가 설문지, 결과보고서 등) 일부를 남기지 않고 있는 경우","정보보호 및 개인정보보호 교육 미이수자를 파악하지 않고 있거나 해당 미이수자에 대한 추가교육 방법(전달교육, 추가교육, 온라인교육 등)을 수립·이행하고 있지 않은 경우",,,
23,2.2.5,직무 변동에 따라 개인정보취급자에서 제외된 인력의 계정과 권한이 개인정보처리시스템 에 그대로 남아 있은 경우,"최근에 퇴직한 주요직무자 및 개인정보취급자에 대하여 자산반납, 권한 회수 등의 퇴직절차 이행 기록이 확인되지 않은 경우",임직원 퇴직 시 자산반납 관리는 잘 이행하고 있으나 인사규정에서 정한 퇴직자 보안점검 및 퇴직확인서를 작성하지 않은 경우,,,,,,
24,2.2.6,정보보호 및 개인정보보호 규정 위반자에 대한 처리 기준 및 절차가 내부 규정에 전혀 포함되어 있지 않은 경우,"보안시스템(DLP, DB접근제어시스템, 내부정보 유출 통제시스템 등)을 통해 정책 위반이 탐지된 관련자에게 경고 메시지를 전달하고 있으나, 이에 대한 소명 및 추가 조사, 징계 처분 등 내부 규정에 따른 후속 조치가 이행되고 있지 않은 경우",,,,,,,
25,2.3.1,"내부 규정에 따라 외부 위탁 및 외부 시설·서비스 현황을 목록으로 관리하고 있으나, 수개월 전에 변경된 위탁업체가 목록에 반영되어 있지 않은 등 현행화 관리가 미흡한 경우",관리체계 범위 내 일부 개인정보처리시스템을 외부 클라우드 서비스로 이전하였으나 이에 대한 식별 및 위험평가가 수행되지 않은 경우,,,,,,,
26,2.3.2,"IT 운영, 개발 및 개인정보 처리업무를 위탁하는 외주용역업체에 대한 위탁계약서가 존재하지 않는 경우",개인정보 처리업무를 위탁하는 외부업체와의 위탁계약서 상에 개인정보 보호법 등 법령에서 요구하는 일부 항목(관리·감독에 관한 사항 등)이 포함되어 있지 않은 경우,인프라 운영과 개인정보 처리업무 일부를 외부업체에 위탁하고 있으나 계약서 등에는 위탁 업무의 특성에 따른 보안요구사항을 식별·반영하지 않고 비밀유지 및 손해배상에 관한 일반 사항만 규정하고 있는 경우,,,,,,
27,2.3.3,회사 내에 상주하여 IT 개발 및 운영 업무를 수행하는 외주업체에 대해서는 정기적으로 보안점검을 수행하고 있지 않은 경우,개인정보 수탁자에 대하여 보안교육을 실시하라는 공문을 발송하고 있으나 교육 수행여부를 확인하고 있지 않은 경우,정보통신서비스 제공자인 신청기관으로부터 개인정보 처리업무를 위탁받은 수탁자 중 일부가 신청기관의 동의 없이 해당 업무를 재위탁한 경우,"수탁자가 자체적으로 보안점검을 수행한 후 그 결과를 통지하도록 하고 있으나, 수탁자가 보안점검을 충실히 수행하고 있는지 여부에 대하여 확인하는 절차가 존재하지 않아 보안 점검 결과의 신뢰성이 매우 떨어지는 경우",,,,,
28,2.3.4,일부 정보시스템에서 계약 만료된 외부자의 계정 및 권한이 삭제되지 않고 존재하는 경우,외주용역사업 수행과정에서 일부 용역업체 담당자가 교체되거나 계약 만료로 퇴직하였으나 관련 인력들에 대한 퇴사시 보안서약서 등 내부 규정에 따른 조치가 이행되지 않은 경우,개인정보 처리 위탁한 업체와 계약 종료 이후 보유하고 있는 개인정보를 파기했는지 여부를 확인 점검하지 않은 경우,,,,,,
29,2.4.1,내부 물리보안 지침에는 개인정보 보관시설 및 시스템 구역을 통제구역으로 지정한다고 명시되어 있으나 멤버십 가입신청 서류가 보관되어 있는 문서고 등 일부 대상 구역이 통제구역에서 누락된 경우,내부 물리보안 지침에 통제구역에 대해서는 지정된 양식의 통제구역 표지판을 설치하도록 명시하고 있으나 일부 통제구역에 표지판을 설치하지 않은 경우,,,,,,,
30,2.4.2,"통제구역을 정의하여 보호대책을 수립하고 출입 가능한 임직원을 관리하고 있으나, 출입기록을 주기적으로 검토하지 않아 퇴직, 전배 등에 따른 장기 미 출입자가 다수 존재하고 있는 경우","전산실, 문서고 등 통제구역에 출입통제 장치가 설치되어 있으나 타당한 사유 또는 승인 없이 장시간 개방 상태로 유지하고 있는 경우",일부 외부 협력업체 직원에게 과도하게 전 구역을 상시 출입할 수 있는 출입카드를 부여하고 있는 경우,,,,,,
31,2.4.3,시스템 배치도가 최신 변경사항을 반영하여 업데이트 되지 않아 장애가 발생된 정보시스템을 신속하게 확인할 수 없는 경우,"서버실 바닥 또는 랙에 많은 케이블이 정리되지 않고 뒤엉켜 있어 전기적으로 간섭, 손상, 누수, 부주의 등에 의한 장애 발생이 우려되는 경우",,,,,,,
32,2.4.4,본사 전산실 등 일부 보호구역에 내부 지침에 정한 보호설비를 갖추고 있지 않은 경우,"전산실 내에 UPS, 소화설비 등의 보호설비는 갖추고 있으나 관련 설비에 대한 운영 및 점검기준을 수립하고 있지 않은 경우",운영지침에 따라 전산실 내에 온·습도 조절기를 설치하였으나 용량 부족으로 인하여 표준 온·습도를 유지하지 못하여 장애발생 가능성이 높은 경우,,,,,,
33,2.4.5,"전산실 출입로그에는 외부 유지보수 업체 직원의 출입기록이 남아 있으나, 이에 대한 보호구역 작업 신청 및 승인 내역은 존재하지 않은 경우(내부 규정에 따른 보호구역 작업 신청 없이 보호구역 출입 및 작업이 이루어지고 있는 경우)","내부 규정에는 보호구역 내 작업기록에 대해 분기별 1회 이상 점검하도록 되어 있으나, 특별한 사유 없이 장기간 동안 보호구역 내 직업기록에 대한 점검이 이루어지고 있지 않은 경우",,,,,,,
34,2.4.6,"이동컴퓨팅기기 반출입에 대한 통제 절차를 수립하고 있으나, 통제구역 내 이동컴퓨팅기기 반입에 대한 통제를 하고 있지 않아 출입이 허용된 내외부인이 이동컴퓨팅기기를 제약없이 사용하고 있는 경우","내부 지침에 따라 전산장비 반출입이 있는 경우 작업계획서에 반출입 내용을 기재하고 관리책임자의 서명을 받도록 되어 있으나, 작업계획서의 반출입 기록에 관리책임자의 서명이 다수 누락되어 있는 경우",,,,,,,
35,2.4.7,개인정보 내부관리계획서 내 개인정보보호를 위한 생활보안 점검(클린데스크 운영 등)을 정기적으로 수행하도록 명시하고 있으나 이를 이행하지 않은 경우,멤버십 가입신청서 등 개인정보가 포함된 서류를 잠금장치가 없는 사무실 문서함에 보관한 경우,직원들의 컴퓨터 화면보호기 및 패스워드가 설정되어 있지 않고 휴가자 책상 위에 중요문서가 장기간 방치되어 있는 경우,"회의실 등 공용 사무 공간에 설치된 공용PC에 대한 보호대책이 수립되어 있지 않아 개인정보가 포함된 파일이 암호화되지 않은 채로 저장되어 있거나 보안 업데이트 미적용, 백신 미설치 등 취약한 상태로 유지하고 있는 경우",,,,,
36,2.5.1,"사용자 및 개인정보취급자에 대한 계정 및 권한에 대한 사용자 등록, 해지 및 승인절차 없이 구두 요청, 이메일 등으로 처리하여 이에 대한 승인 및 처리 이력이 확인되지 않는 경우","개인정보취급자가 휴가, 출장, 공가 등에 따른 업무 백업을 사유로 공식적인 절차를 거치지 않고 개인정보취급자로 지정되지 않은 인원에게 개인정보취급자 계정을 알려주는 경우",정보시스템 또는 개인정보처리시스템 사용자에게 필요 이상의 과도한 권한을 부여하여 업무상 불필요한 정보 또는 개인정보에 접근이 가능한 경우,,,,,,
37,2.5.2,"정보시스템(서버, 네트워크, 침입차단시스템, DBMS 등)의 계정 현황을 확인한 결과, 제조 사에서 제공하는 기본 관리자 계정을 변경하지 않고 사용하고 있는 경우","개발자가 개인정보처리시스템 계정을 공용으로 사용하고 있으나, 타당성 검토 또는 책임자 의 승인 등이 없이 사용하고 있는 경우",외부직원이 유지보수하고 있는 정보시스템의 운영계정을 별도의 승인 절차 없이 개인 계정처럼 사용하고 있는 경우,,,,,,
38,2.5.3,개인정보취급자가 공개된 외부 인터넷망을 통해서 개인정보처리시스템에 접근 시 안전한 인증수단을 적용하지 않고 아이디·비밀번호 방식으로만 인증하고 있는 경우,"정보시스템 및 개인정보처리시스템 로그인 실패 시 해당 아이디가 존재하지 않거나 비밀번호가 틀림을 자세히 표시해 주고 있으며, 로그인 실패 흿수에 대한 제한이 없는 경우",,,,,,,
