no,id,err1,err2,err3,err4,err5,err6,err7,err8,err9
39,2.5.4,"정보보호 및 개인정보보호 관련 정책, 지침 등에서 비밀번호 생성규칙의 기준을 정하고 있으나 일부 정보시스템 및 개인정보처리시스템에서 내부 지침과 상이한 비밀번호를 사용하고 있는 경우","비밀번호 관련 내부 규정에는 비밀번호를 초기화 시 임시 비밀번호를 부여받고 강제적으로 변경하도록 되어 있으나, 실제로는 임시 비밀번호를 그대로 사용하는 경우",사용자 및 개인정보취급자의 비밀번호 변경주기가 규정되어 있음에도 불구하고 변경하지 않고 그대로 사용하고 있는 경우,,,,,,
40,2.5.5,"정보시스템 및 개인정보처리시스템의 관리자 및 특수 권한 부여 등의 승인 이력이 시스템이나 문서상으로 확인이 되지 않거나, 승인 이력과 특수권한 내역이 서로 일치되지 않는 경우","내부 규정에는 개인정보 관리자 및 특수권한자를 목록으로 작성·관리하도록 되어 있으나 이를 작성 관리하고 있지 않거나, 보안시스템 관리자 등 일부 특수권한이 식별 관리되지 않는 경우",정보시스템 및 개인정보처리시스템의 유지보수를 위하여 분기 1회에 방문하는 유지보수용 특수 계정이 사용기간 제한이 없이 상시로 활성화되어 있는 경우,관리자 및 특수 권한의 사용 여부를 정기적으로 검토하지 않아 일부 특수권한자의 업무가 변경되었음에도 불구하고 기존 관리자 및 특수 권한을 계속 보유하고 있는 경우,,,,,
41,2.5.6,"접근권한 검토와 관련된 방법, 점검주기, 보고체계, 오·남용 기준 등이 관련 지침에 구체적으로 정의되어 있지 않아 접근권한 검토가 정기적으로 수행되지 않은 경우","내부 정책, 지침 등에 장기 미사용자 계정에 대한 잠금(비활성화) 또는 삭제 조치하도록 되어있으나 6개월 이상 미접속한 사용자의 계정이 활성화 되어 있는 경우(접근권한 검토 가 충실히 수행되지 않아 해당 계정이 식별되지 않은 경우)","접근권한 검토 시 접근권한의 과다 부여 및 오·남용 의심사례가 발견되었으나 이에 대한 상세조사, 내부보고 등의 후속조치가 수행되지 않은 경우",,,,,,
42,2.6.1,"네트워크 구성도와 인터뷰를 통해 확인한 결과, 외부 지점에서 사용하는 정보시스템 및 개인정보처리시스템과 IDC에 위치한 서버간의 연결 시 일반 인터넷 회선을 통해 데이터 송 수신을 처리하고 있어 내부 규정에 명시된 VPN이나 전용망 등을 이용한 통신이 이루어지고 있지 않은 경우","내부망에 위치한 DB서버 등 일부 중요 서버의 IP주소가 내부 규정과 달리 공인 IP로 설정 되어 있고, 네트워크 접근 차단이 적용되어 있지 않은 경우",서버팜이 구성되어 있으나 네트워크 접근제어 설정 미흡으로 내부망에서 서버팜으로의 접근이 과도하게 허용되어 있는 경우,"외부자(외부 개발자, 방문자 등)에게 제공되는 네트워크를 별도의 통제 없이 내부 업무 네트워크와 분리하지 않은 경우","내부 규정과는 달리 MAC 주소 인증, 필수 보안 소프트웨어 설치 등의 보호대책을 적용하지 않은 상태로 네트워크 케이블 연결만으로 사내 네트워크에 접근 및 이용할 수 있는 경우",,,,
43,2.6.2,사무실에서 서버관리자가 IDC에 위치한 윈도우 서버에 접근 시 터미널 서비스를 이용하여 접근하고 있으나 터미널 서비스에 대한 Session Timeout 설정이 되어 있지 않아 장시간 아무런 작업을 하지 않아도 해당 세션이 차단되지 않는 경우,서버 간의 접속이 적절히 제한되지 않아 특정 사용자가 본인에게 인가된 서버에 접속한 후 해당 서버를 경유하여 다른 인가받지 않은 서버에도 접속할 수 있는 경우,"타당한 사유 또는 보완 대책 없이 안전하지 않은 접속 프로토콜(telnet, ftp 등)을 사용하여 접근하고 있으며, 불필요한 서비스 및 포트를 오픈하고 있는 경우",,,,,,
44,2.6.3,응용프로그램의 개인정보 처리화면 중 일부 화면의 권한 제어 기능에 오류가 존재하여 개인정보 열람 권한이 없는 사용자에게도 개인정보가 노출되고 있는 경우,응용프로그램의 관리자 페이지가 외부 인터넷에 오픈되어 있으면서 안전한 인증수단이 적용되어 있지 않은 경우,응용프로그램에 대해 타당한 사유 없이 세션 타임아웃 또는 동일 사용자 계정의 동시 접속을 제한하고 있지 않은 경우,응용프로그램을 통해 개인정보를 다운로드 받는 경우 해당 파일 내에 주민등록번호 등 업무상 불필요한 정보가 과도하게 포함되어 있는 경우,"응용프로그램의 개인정보 조회화면에서 like 검색을 과도하게 허용하고 있어, 모든 사용자가 본인의 업무 범위를 초과하여 전체 고객 정보를 조회할 수 있는 경우",,,,
45,2.6.4,대량의 개인정보를 보관·처리하고 있는 데이터베이스를 인터넷을 통해 접근 가능한 웹 응용프로그램과 분리하지 않고 물리적으로 동일한 서버에서 운영하고 있는 경우,개발자 및 운영자들이 응응 프로그램에서 사용하고 있는 계정을 공유하여 운영 데이터베이스에 접속하고 있는 경우,"내부 규정에는 데이터베이스의 접속권한을 오브젝트별로 제한하도록 되어 있으나, 데이터베이스 접근권한을 운영자에게 일괄 부여하고 있어 개인정보 테이블에 접근할 필요가 없는 운영자에게도 과도하게 접근 권한이 부여된 경우","DB접근제어 솔루션을 도입하여 운영하고 있으나, 데이터베이스 접속자에 대한 IP주소 등이 적절히 제한되어 있지 않아 DB접근제어 솔루션을 우회하여 데이터베이스에 접속하고 있는 경우","개인정보를 저장하고 있는 데이터베이스의 테이블 현황이 파악되지 않아, 임시로 생성된 테이블에 불필요한 개인정보가 파기되지 않고 대량으로 저장되어 있는 경우",,,,
46,2.6.5,외부인용 무선 네트워크와 내부 무선 네트워크 영역대가 동일하여 외부인도 무선네트워크를 통해 별도의 통제없이 내부 네트워크에 접근이 가능한 경우,무선 AP 설정 시 정보 송수신 암호화 기능을 설정하였으나 안전하지 않은 방식으로 설정 한 경우,"업무 목적으로 내부망에 연결된 무선AP에 대하여 SSID 브로드캐스팅 허용, 무선AP 관리자 비밀번호 노출(디폴트 비밀번호 사용), 접근제어 미적용 등 보안 설정이 미흡한 경우",,,,,,
47,2.6.6,"내부 규정에는 시스템에 대한 원격 접근은 원칙적으로 금지하고 불가피한 경우 IP 기반의 접근통제를 통해 승인된 사용자만 접근할 수 있도록 명시하고 있으나 시스템에 대한 원격 데스크톱 연결, SSH 접속이 IP주소 등으로 제한되어 있지 않아 모든 PC에서 원격 접속이 가능한 경우",원격운영관리를 위해 VPN을 구축하여 운영하고 있으나 VPN에 대한 사용 승인 또는 접속 기간 제한 없이 상시 허용하고 있는 경우,"부 근무자를 위해 개인 스마트 기기에 업무용 모바일 앱을 설치하여 운영 하고 있으나 악성코드, 분실·도난 등에 의한 개인정보 유출을 방지하기 위한 적절한 보호대책(백신, 초기화, 암호화 등)을 적용하고 있지 않은 경우",,,,,,
48,2.6.7,정보통신망법 등 관련 법규에 따라 망분리를 적용하였으나 개인정보처리시스템의 접근권한 설정 가능자 등 일부 의무대상자에 대해 망분리 적용이 누락된 경우,"망분리 의무대상으로서 망분리를 적용하였으나 타 서버를 경유한 우회접속이 가능하여 망분리가 적용되지 않은 환경에서 개인정보처리시스템 접속 및 개인정보의 다운로드, 파기 등이 가능한 경우",DMZ 및 내부망에 위치한 일부 서버에서 불필요하게 인터넷으로의 직접 접속이 가능한 경우,"인터넷 PC와 내부 업무용 PC를 망분리하고 망간 자료전송시스템을 구축·운영하고 있으나, 자료 전송에 대한 승인 절차가 부재하고 자료 전송 내역에 대한 주기적 검토가 이루어 지고 있지 않은 경우","내부 규정에는 개인정보취급자가 P2P 및 웹하드 사이트 접속 시 책임자 승인을 거쳐 특정 기간 동안만 허용하도록 되어 있으나, 승인절차를 거치지 않고 예외 접속이 허용된 사례가 다수 존재하는 경우",,,,
49,2.7.1,"내부 정책·지침에 암호통제 관련 법적 요구사항을 고려한 암호화 대상, 암호 강도, 저장 및 전송 시 암호화 방법, 암호화 관련 담당자의 역할 및 책임 등에 관한 사항이 적절히 명시되지 않은 경우",암호정책을 수립하면서 해당 기업이 적용받는 법규를 잘못 적용하여(정보통신망법 대상자 에게 개인정보 보호법의 암호화 요건 적용) 암호화 관련 법적 요구사항을 준수하지 못하고 있는 경우,개인정보취급자 및 정보주체(이용자)의 비밀번호에 대하여 일방향 암호화를 적용하였으나 안전하지 않은 MD5 알고리즘을 사용한 경우,"정보통신망법 및 내부 규정에 따라 인터넷 웹사이트에 대하여 보안서버를 적용하였으나, 회원정보 조회 및 변경, 비밀번호 찾기, 비밀번호 변경 등 개인정보가 전송되는 일부 구간에 암호화 조치가 누락된 경우",,,,,
50,2.7.2,"암호 정책 내에 암호키 관리와 관련된 절차, 방법 등이 명시되어 있지 않아 담당자 별로 암호키 관리 수준 및 방법이 상이한 등 암호키 관리 상에 취약사항이 존재하는 경우","내부 규정에 중요 정보를 암호화할 경우 관련 책임자 승인 하에 암호화 키를 생성하고 암호키 관리대장을 작성하도록 정하고 있으나, 암호키 관리대장에 일부 암호키가 누락되어 있거나 현행화되어 있지 않은 경우",,,,,,,
51,2.8.1,정보시스템 인수 전 보안성 검증 기준 및 절차가 마련되어 있지 않은 경우,신규 시스템 도입 시 기존 운영환경에 대한 영향 및 보안성을 검토하도록 내부 규정을 마련하고 있으나 최근 도입한 일부 시스템에 대해 인수테스트(취약점 점검) 등의 관련 보안성 검토 수행 증적이 확인되지 않은 경우,"개발 관련 내부 지침에 개발과 관련된 주요 보안요구사항(인증 및 암호화, 보안로그 등)이 정의되어 있지 않은 경우","‘개발표준정의서’에 사용자 패스워드를 안전하지 않은 암호화 알고리즘(MD5, SHA1)으로 사용하도록 되어 있어 관련 법적 요구사항을 적절히 반영하지 않는 경우",,,,,
52,2.8.2,정보시스템 구현 이후 개발 관련 내부 지침 및 문서에 정의된 보안요구사항을 시험하지 않고 있는 경우,응용프로그램 테스트 시나리오 및 기술적 취약점 점검항목에 입력값 유효성 체크 등의 중요 점검항목 일부가 누락된 경우,"구현 또는 시험 과정에서 알려진 기술적 취약성이 존재하는지 여부를 점검하지 않거나, 타당한 사유 또는 승인 없이 확인된 취약성에 대한 개선조치를 이행하지 않은 경우",공공기관이 5만명 이상 정보주체의 고유식별정보를 처리하는 등 영향평가 의무 대상 개인정보파일 및 개인정보처리시스템을 신규로 구축하면서 영향평가를 실시하지 않은 경우,공공기관이 영향평가를 수행한 후 영향평가 기관으로부터 영향평가서를 제출 받은지 2개월이 지났음에도 불구하고 영향평가서를 개인정보보호위원회 위원장(구.행정안전부장관)에게 제출하지 않은 경우,,,,
53,2.8.3,타당한 사유 또는 승인 없이 별도의 개발환경을 구성하지 않고 운영환경에서 직접 소스코드 변경을 수행하고 있는 경우,"불가피하게 개발시스템과 운영시스템을 분리하지 않고 운영 중에 있으나, 이에 대한 상호 검토 내역, 모니터링 내역 등이 누락되어 있는 경우",개발시스템이 별도로 구성되어 있으나 개발환경으로부터 운영환경으로의 접근이 통제되지 않아 개발자들이 개발시스템을 경유하여 불필요하게 운영시스템 접근이 가능한 경우,,,,,,
54,2.8.4,개발 서버에서 사용할 시험 데이터 생성에 대한 구체적 가준 및 절차가 수립되어 있지 않은 경우,타당한 사유 및 책임자 승인 없이 실 운영데이터를 가공하지 않고 시험 데이터로 사용하고 있는 경우,"불가피한 사유로 사전 승인을 받아 실 운영데이터를 시험 용도로 사용하면서, 테스트 DB에 대해 운영 DB와 동일한 수준의 접근통제를 적용하고 있지 않은 경우",실 운영데이터를 테스트 용도로 사용한 후 테스트가 완료되었음에도 실 운영데이터를 테스트 DB에서 삭제하지 않은 경우,,,,,
55,2.8.5,"별도의 소스 프로그램 백업 및 형상관리 시스템이 구축되어 있지 않으며, 이전 버전의 소스코드를 운영 서버 또는 개발자 PC에 승인 및 이력관리 없이 보관하고 있는 경우","형상관리시스템을 구축하여 운영하고 있으나 형상관리시스템 또는 형상관리시스템에 저장된 소스코드에 대한 접근제한, 접근 및 변경이력이 적절히 관리되지 않고 있는 경우","내부 규정에는 형상관리시스템을 통해 소스 프로그램 버전관리를 하도록 되어 있으나, 최신 버전의 소스 프로그램은 개발자 PC에만 보관되어 있고 이에 대한 별도의 백업이 수행 되고 있지 않은 경우",,,,,,
56,2.8.6,개발·변경이 완료된 소스 프로그램을 운영환경으로 이관 시 검토·승인하는 절차가 마련되어 있지 않은 경우,"운영서버에 서비스 실행에 불필요한 파일(소스코드 또는 배포모듈, 백업본, 개발 관련 문서, 매뉴얼 등)이 존재하는 경우",내부 지침에 운영환경 이관 시 안전한 이관·복구를 위해 변경작업 요청서 및 결과서를 작성 하도록 정하고 있으나 관련 문서가 확인되지 않는 경우,,,,,,
57,2.9.1,최근 DMZ 구간 이중화에 따른 변경 작업을 수행하였으나 변경 후 발생할 수 있는 보안위험성 및 성능 평가에 대한 수행 승인 증적이 확인되지 않은 경우,"최근 네트워크 변경 작업을 수행하였으나 관련 검토 및 공지가 충분히 이루어지지 않아 네트워크 구성도 및 일부 접근통제시스템(침입차단시스템, DB접근제어시스템 등)의 접근 통제리스트(ACL)에 적절히 반영되어 있지 않은 경우",변경관리시스템을 구축하여 정보시스템 입고 또는 변경 시 성능 및 보안에 미치는 영향을 분석·협의하고 관련 이력을 관리하도록 하고 있으나 해당 시스템을 통하지 않고도 시스템 변경이 가능하며 관련 변경사항이 적절히 검토되지 않는 경우,,,,,,
58,2.9.2,성능 및 용량 관리를 위한 대상별 요구사항(임계치 등)을 정의하고 있지 않거나 정기 점검보고서 등에 기록하고 있지 않아 현황을 파악할 수 없는 경우,성능 또는 용량 기준을 초과하였으나 관련 검토 및 후속조치방안 수립·이행이 이루어지고 있지 않은 경우,전산장비 장애대응절차를 수립하고 있으나 네트워크 구성 및 외주업체 변경 등의 내·외부 환경변화가 적절히 반영되어 있지 않은 경우,장애처리절차와 장애유형별 조치방법 간에 일관성이 없거나 예상소요시간 산정에 대한 근거가 부족해 신속·정확하고 체계적인 대응이 어려운 경우,,,,,
59,2.9.3,"백업 대상, 주기, 방법, 절차 등이 포함된 백업 및 복구 절차가 수립되어 있지 않은 경우","백업정책을 수립하고 있으나 법적 요구사항에 따라 장기간(6개월, 3년, 5년 등) 보관이 필요한 백업 대상 정보가 백업 정책에 따라 보관되고 있지 않은 경우",상위 지침 또는 내부 지침에 따라 별도로 백업하여 관리하도록 명시된 일부 시스템(보안시스템 정책 및 로그 등)에 대한 백업이 이행되고 있지 않은 경우,상위 지침 또는 내부 지침에는 주기적으로 백업매체에 대한 복구 테스트를 수행하도록 정하고 있으나 복구테스트를 장기간 실시하지 않은 경우,,,,,
60,2.9.4,"로그 기록 대상, 방법, 보존기간, 검토 주기, 담당자 등에 대한 세부 기준 및 절차가 수립되어 있지 않은 경우","보안 이벤트 로그, 응용 프로그램 및 서비스 로그(Windows 2008 서버 이상)등 중요 로그 에 대한 최대 크기를 충분하게 설정하지 않아 내부 기준에 정한 기간 동안 기록`.보관되고 있지 않은 경우",중요 Linux/UNIX 계열 서버에 대한 로그 기록을 별도로 백업하거나 적절히 보호하지 않아 사용자의 명령 실행 기록 및 접속 이력 등을 임의로 삭제할 수 있는 경우,"개인정보처리시스템에 접속한 기록을 확인한 결과 접속자의 계정, 접속 일시, 접속자 IP주소 정보는 남기고 있으나 수행업무(조회, 변경, 삭제, 다운로드 등)와 관련된 정보를 남기고 있지 않은 경우",로그 서버의 용량의 충분하지 않아서 개인정보처리시스템 접속기록이 3개월 밖에 남아 있지 않은 경우,,,,
61,2.9.5,"중요 정보를 처리하고 있는 정보시스템에 대한 이상접속(휴일 새벽 접속, 우회경로 접속 등) 또는 이상행위(대량 데이터 조회 또는 소량 데이터의 지속적·연속적 조회 등)에 대한 모니터링 및 경고·알림 정책(기준)이 수립되어 있지 않은 경우",내부 지침 또는 시스템 등에 접근 및 사용에 대한 주기적인 점검·모니터링 기준을 마련하고 있으나 실제 이상접속 및 이상행위에 대한 검토 내역이 확인되지 않는 경우,정보통신망법을 적용 받는 정보통신서비스 제공자가 개인정보처리 시스템의 접속기록 점검주기를 반기 1회로 정하고 있는 경우,,,,,,
62,2.9.6,"일부 중요 시스템(보안시스템, CCTV 등)의 시각이 표준시와 동기화되어 있지 않으며 관련 동기화 여부에 대한 주기적 점검이 이행되고 있지 않은 경우","내부 NTP 서버와 시각을 동기화하도록 설정하고 있으나 일부 시스템의 시각이 동기화되지 않고 있고, 이에 대한 원인분석 및 대응이 이루어지고 있지 않은 경우",,,,,,,
63,2.9.7,"개인정보취급자 PC를 재사용할 경우 데이터 삭제 프로그램을 이용하여 완전삭제 하도록 정책 및 절차가 수립되어 있으나, 실제로는 완전삭제 조치 없이 재사용 하거나 기본 포맷만 하고 재사용하고 있는 등 관련 절차가 이행되고 있지 않은 경우","외부업체를 통해 저장매체를 폐기하고 있으나, 계약 내용 상 안전한 폐기 절차 및 보호대책에 대한 내용이 누락되어 있고 폐기 이행 증적 확인 및 실사 등의 관리 감독이 이루어지지 않은 경우",폐기된 HDD의 일련번호가 아닌 시스템 명을 기록하거나 폐기 대장을 작성하지 않아 폐기 이력 및 추적할 수 있는 증적을 확인할 수 없는 경우,회수한 폐기 대상 하드디스크가 완전 삭제되지 않은 상태로 잠금장치 되지 않은 장소에 방치되고 있는 경우,,,,,
64,2.10.1,침입차단시스템 보안정책에 대한 정기 검토가 수행되지 않아 불필요하거나 과도하게 허용된 정책이 다수 존재하는 경우,"보안시스템 보안정책의 신청, 변경, 삭제, 주기적 검토에 대한 절차 및 기준이 없거나, 절차는 있으나 이를 준수하지 않은 경우",보안시스템의 관리자 지정 및 권한 부여 현황에 대한 관리감독이 적절히 이행되고 있지 않은 경우,내부 지침에는 정보보호담당자가 보안시스템의 보안정책 변경 이력을 기록·보관하도록 정하고 있으나 정책관리대장을 주기적으로 작성하지 않고 있거나 정책관리대장에 기록된 보안 정책과 실제 운영 중인 시스템의 보안정책이 상이한 경우,,,,,
65,2.10.2,클라우드 서비스 계약서 내에 보안에 대한 책임 및 역할 등에 대한 사항이 포함되어 있지 않은 경우,클라우드 서비스의 보안설정을 변경할 수 있는 권한이 업무상 반드시 필요하지 않은 직원들에게 과도하게 부여되어 있는 경우,내부 지침에는 클라우드 내 사설 네트워크의 접근통제 룰(Rule) 변경 시 보안책임자 승인을 받도록 하고 있으나 승인절차를 거치지 않고 등록·변경된 접근제어 룰이 다수 발견된 경우,클라우드 서비스의 보안설정 오류로 내부 로그 파일이 인터넷을 통해 공개되어 있는 경우,,,,,
66,2.10.3,인터넷에 공개된 웹사이트의 취약점으로 인하여 구글 검색을 통해 열람 권한이 없는 타인의 개인정보에 접근할 수 있는 경우,"웹 사이트에 개인정보를 게시하는 경우 승인 절차를 거치도록 내부 규정이 마련되어 있으나, 이를 준수하지 않고 개인정보가 게시된 사례가 다수 존재한 경우",게시판 등의 웹 응용프로그램에서 타인이 작성한 글을 임의로 수정·삭제하거나 비밀번호로 보호된 글을 열람할 수 있는 경우,,,,,,
67,2.10.4,"전자결제대행업체와 위탁 계약을 맺고 연계를 하였으나, 적절한 인증 및 접근제한 없이 특정 URL을 통해 결제 관련 정보가 모두 평문으로 전송되는 경우",전자결제대행업체와 외부 연계 시스템이 전용망으로 연결되어 있으나 해당 연계 시스템에서 내부 업무 시스템으로의 접근이 침입차단시스템 등으로 적절히 통제되지 않고 있는 경우,"내부 지침에는 외부 핀테크 서비스 연계 시 정보보호팀의 보안성 검토를 받도록 되어 있으나, 최근에 신규 핀테크 서비스를 연계하면서 일정 상의 이유로 보안성 검토를 수행하지 않은 경우",,,,,,
68,2.10.5,"대외 기관과 연계 시 전용망 또는 VPN을 적용하고 중계서버와 인증서 적용 등을 통해 안전하게 정보를 전송하고 있으나 외부 기관별 연계 시기, 방식, 담당자 및 책임자, 연계 정보, 법적 근거 등에 대한 현황관리가 적절히 이루어지지 않고 있는 경우","중계과정에서의 암호 해제 구간 또는 취약한 암호화 알고리즘(DES, 3DES) 사용 등에 대한 보안성 검토, 보안표준 및 조치방안 수립 등에 대한 협의가 이행되고 있지 않은 경우",,,,,,,
69,2.10.6,"업무적인 목적으로 노트북, 태블릿PC 등 모바일기기를 사용하고 있으나 업무용 모바일 기 기에 대한 허용 기준, 사용 범위, 승인 절차, 인증 방법 등에 대한 정책이 수립되어 있지 않는 경우","모바일 기기 보안관리 지침에서는 모바일 기기의 업무용 사용을 원칙적으로 금지하고 필요 시 승인 절차를 통해 제한된 기간 동안 허가된 모바일 기기만 사용하도록 정하고 있으나, 허가된 모바일 기기가 식별·관리되지 않고 승인되지 않은 모바일 기기에서도 내부 정보시스템 접속이 가능한 경우",개인정보 처리업무에 이용되는 모바일 기기에 대하여 비밀번호 설정 등 도난·분실에 대한 보호대책이 적용되어 있지 않은 경우,"내부 규정에서는 업무용 단말기의 공유폴더 사용을 금지하고 있으나, 이에 대한 주기적인 점검이 이루어지고 있지 않아 다수의 업무용 단말기에서 과도하게 공유폴더를 설정하여 사용하고 있는 경우",,,,,
70,2.10.7,"통제구역인 서버실에서의 보조저장매체 사용을 제한하는 정책을 수립하여 운영하고 있으나, 예외 승인 절차를 준수하지 않고 보조저장매체를 사용한 이력이 다수 확인되었으며, 보조저장매체 관리실태에 대한 주기적 점검이 실시되지 않아 보조저장매체 관리대장의 현행화가 미흡한 경우",개인정보가 포함된 보조저장매체를 잠금장치가 있는 안전한 장소에 보관하지 않고 사무실 서랍 등에 방치하고 있는 경우,"보조저장매체 통제 솔루션을 도입·운영하고 있으나 일부 사용자에 대해 적절한 승인 절차없이 예외처리 되어, 쓰기 권한 등이 허용된 경우","전산실에 위치한 일부 공용 PC 및 전산장비에서 일반 USB에 대한 쓰기가 가능한 상황이나 매체 반입 및 사용 제한, 사용이력 기록 및 검토 등 통제가 적용되고 있지 않는 경우",,,,,
