no,id,err1,err2,err3,err4,err5,err6,err7,err8,err9
71,2.10.8,일부 시스템에서 타당한 사유나 책임자 승인 없이 OS패치가 장기간 적용되고 있지 않은 경우,"일부 시스템에 서비스 지원이 종료(EOS)된 OS버전을 사용 중이나, 이에 따른 대응계획이나 보완대책이 수립되어 있지 않은 경우","상용 소프트웨어 및 OS에 대해서는 최신패치가 적용되고 있으나, 오픈소스 프로그램(openssl, openssh, Apache 등)에 대해서는 최신 패치를 확인하고 적용하는 절차 및 담당자가 지정 되어 있지 않아 최신 보안패치가 적용되고 있지 않은 경우",,,,,,
72,2.10.9,"일부 PC 및 서버에 백신이 설치되어 있지 않거나, 백신 엔진이 장기간 최신 버전으로 업데이트되지 않은 경우","백신 프로그램의 환경설정(실시간 검사, 예약검사, 업데이트 설정 등)을 이용자가 임의로 변경할 수 있음에도 그에 따른 추가 보호대책이 수립되어 있지 않은 경우",백신 중앙관리시스템에 접근통제 등 보호대책이 미비하여 중앙관리시스템을 통한 침해사고 발생 가능성이 있는 경우 또는 백신 패턴에 대한 무결성 검증을 하지 않아 악의적인 사용자에 의한 악성코드 전파 가능성이 있는 경우,"일부 내부망 PC 및 서버에서 다수의 악성코드 감염이력이 확인되었으나 감염 현황, 감염경로 및 원인 분석, 그에 따른 조치내역 등이 확인되지 않은 경우",,,,,
73,2.11.1,침해사고에 대비한 침해사고 대응 조직 및 대응 절차를 명확히 정의하고 있지 않은 경우,"내부 지침 및 절차에 침해사고 단계별(사고 전, 인지, 처리, 복구, 보고 등) 대응 절차를 수립하여 명시하고 있으나 침해사고 발생 시 사고 유형 및 심각도에 따른 신고·통지 절차, 대응 및 복구 절차의 일부 또는 전부를 수립하고 있지 않은 경우",침해사고 대응 조직도 및 비상연락망 등을 현행화하지 않고 있거나 담당자별 역할과 책임이 명확히 정의되어 있지 않은 경우,"침해사고 신고·통지 및 대응 협조를 위한 대외기관 연락처에 기관명, 홈페이지, 연락처 등이 잘못 명시되어 있거나 일부 기관 관련 정보가 누락 또는 현행화 되지 않은 경우",외부 보안관제 전문업체 등 유관기관에 침해사고 탐지 및 대응을 위탁하여 운영하고 있으나 침해사고 대응에 대한 상호 간 관련 역할 및 책임 범위가 계약서나 SLA에 명확하게 정의되지 않은 경우,"침해사고 대응절차를 수립하였으나 개인정보 침해 신고 기준, 시점 등이 법적 요구사항을 준수하지 못한 경우",,,
74,2.11.2,"내부 규정에 연 1회 이상 주요 시스템에 대한 기술적 취약점 점검을 하도록 정하고 있으나, 주요 시스템 중 일부가 취약점 점검 대상에서 누락된 경우","취약점 점검에서 발견된 취약점에 대한 보완조치를 이행하지 않았거나, 단기간 내에 조치할 수 없는 취약점에 대한 타당성 검토 및 승인 이력이 없는 경우",,,,,,,
75,2.11.3,"외부로부터의 서버, 네트워크, 데이터베이스, 보안시스템에 대한 침해 시도를 인지할 수 있도록 하는 상시 또는 정기적 모니터링 체계 및 절차를 마련하고 있지 않은 경우","외부 보안관제 전문업체 등 외부 기관에 침해시도 모니터링 업무를 위탁 하고 있으나, 위탁업체가 제공한 관련 보고서를 검토한 이력이 확인되지 않거나 위탁 대상에서 제외된 시스템에 대한 자체 모니터링 체계를 갖추고 있지 않은 경우",내부적으로 정의한 임계치를 초과하는 이상 트래픽이 지속적으로 발견되고 있으나 이에 대한 대응조치가 이루어지고 있지 않는 경우,,,,,,
76,2.11.4,침해사고 모의훈련을 수행하지 않았거나 관련 계획서 및 결과보고서가 확인되지 않는 경우,연간 침해사고 모의훈련 계획을 수립하였으나 타당한 사유 또는 승인 없이 해당 기간 내에 실시하지 않은 경우,모의훈련을 계획하여 실시하였으나 관련 내부 지침에 정한 절차 및 서식에 따라 수행하지 않은 경우,,,,,,
77,2.11.5,"내부 침해사고 대응지침에는 침해사고 발생 시 정보보호위원회 및 이해관계 부서에게 보고 하도록 정하고 있으나, 침해사고 발생 시 담당 부서에서 자체적으로 대응 조치 후 정보보호위원회 및 이해관계 부서에 보고하지 않은 경우",최근 DDoS 공격으로 의심되는 침해사고로 인해 서비스 일부가 중단된 사례가 있으나 이에 대한 원인분석 및 재발방지 대책이 수립되지 않은 경우,,,,,,,
78,2.12.1,"IT 재해 복구 절차서 내에 IT 재해 복구 조직 및 역할 정의, 비상연락체계, 복구 절차 및 방법 등 중요한 내용이 누락되어 있는 경우",비상사태 발생 시 정보시스템의 연속성 확보 및 피해 최소화를 위해 백업센터를 구축하여 운영하고 있으나 관련 정책에 백업센터를 활용한 재해 복구 절차 등이 수립되어 있지 않아 재해 복구 시험 및 복구가 효과적으로 진행되기 어려운 경우,서비스 운영과 관련된 일부 중요 시스템에 대한 복구 목표시간이 정의되어 있지 않으며 이에 대한 적절한 복구 대책을 마련하고 있지 않은 경우,"재해 복구 관련 지침서 등에 IT 서비스 또는 시스템에 대한 복구 우선순위, 복구 목표시간(RTO), 복구 목표시점(RPO) 등이 정의되어 있지 않은 경우","현실적 대책 없이 복구 목표시간(RTO)을 과도 또는 과소하게 설정하고 있거나 복구 목표시점(RPO)과 백업정책(대상, 주기 등)이 적절히 연계되지 않아 복구 효과성을 보장할 수 없는 경우",,,,
79,2.12.2,재해 복구 훈련을 계획·시행하지 않았거나 관련 계획서 및 결과보고서가 확인되지 않는 경우,재해 복구 훈련 계획을 수립하였으나 타당한 사유 또는 승인 없이 계획대로 실시하지 않았거나 관련 결과보고가 확인되지 않는 경우,재해 복구 훈련을 계획하여 실시하였으나 내부 관련 지침에 정한 절차 및 서식에 따라 이행되지 않아 수립한 재해 복구 절차의 적정성 및 효과성을 평가하기 위한 훈련으로 보기 어려운 경우,,,,,,
80,3.1.1,회원가입 시 서비스 제공을 위해 필요한 최소한의 정보 외의 기타 정보들을 수집하면서 필수항목과 선택항목으로 구분하지 않고 일괄로 동의를 받는 경우,"회원가입 양식에서 필수정보와 선택정보로 나눠서 동의를 받고 있으나, 필수정보에 포함된 개인정보 항목에 서비스 제공을 위해 필요한 최소한의 정보 외의 과도한 개인정보 항목이 포함되어 있는 경우","회원가입 양식에서 필수와 선택 정보를 구분하여 별도 동의를 받도록 되어 있었으나, 선택정보에 대해 동의하지 않아도 회원가입이 가능함을 정보주체가 인지할 수 있도록 구체적으로 알리지 않은 경우 (개인정보 입력 양식에 개인정보 항목별로 필수, 선택 여부가 표시되어 있지 않은 경우 등)",홈페이지 회원가입 화면에서 선택사항에 대해 동의하지 않거나 선택정보를 입력하지 않으면 다음 단계로 넘어가지 않거나 회원가입이 차단되는 경우,채용 계약 시 채용 예정 직무와 직접 관련이 없는 가족사항 등 과도한 개인정보를 수집하는 경우,,,,
81,3.1.2,개인정보 보호법을 적용받는 개인정보처리자가 개인정보 수집 동의 시 고지 사항에 “동의 거부 권리 및 동의 거부에 따른 불이익 내용”을 누락한 경우,개인정보 수집 동의 시 수집하는 개인정보 항목을 구체적으로 명시하지 않고 등과 같이 포괄적으로 안내하는 경우,쇼핑몰 홈페이지에서 회원가입 시 회원가입에 필요한 개인정보 외에 추후 물품 구매 시 필요한 결제 배송 정보를 미리 필수 항목으로 수집하는 경우,"Q&A, 게시판을 통해 비회원의 개인정보(이름, 이메일, 휴대폰번호)를 수집하면서 개인정보 수집 동의 절차를 거치지 않은 경우",만 14세 미만 아동의 개인정보를 수집하면서 법정대리인의 동의를 받지 않은 경우,"만 14세 미만 아동에 대해 서비스를 제공하고 있지 않지만, 회원가입 단계에서 입력받는 생년월일을 통해 나이 체크를 하지 않아 법정대리인 동의 없이 가입 된 만 14세 미만 아동 회원이 존재한 경우",법정대리인의 진위 여부를 확인하는 절차가 미흡하여 미성년자 등 아동의 법정대리인으로 보기 어려운데도 법정대리인 동의가 가능한 경우,"만 14세 미만 아동으로부터 법정대리인 동의를 받는 목적으로 법정대리인의 개인정보(이름, 휴대폰번호)를 수집한 이후 법정대리인의 동의가 장기간 확인되지 않았음에도 이를 파 기하지 않고 계속 보유하고 있는 경우","법정대리인 동의에 근거하여 만 14세 미만 아동의 개인정보를 수집하였으나, 관련 기록을 보존하지 않아 법정대리인 동의와 관련된 사항(법정대리인명, 동의 일시 등)을 확인할 수 없는 경우"
82,3.1.3,"홈페이지 가입과 관련하여 실명확인, 단순 회원관리 목적을 위해 정보주체(이용자)의 동의에 근거하여 주민등록번호를 수집한 경우",정보주체의 주민등록번호를 시행규칙이나 지방자치단체의 조례에 근거하여 수집한 경우,"비밀번호 분실 시 본인확인 등의 목적으로 주민등록번호 뒷 6자리를 수집하지만, 관련된 법적 근거가 없는 경우",채용전형 진행단계에서 법적 근거 없이 입사지원자의 주민등록번호를 수집한 경우,"콜센터에 상품, 서비스 관련 문의 시 본인확인을 위해 주민등록번호를 수집한 경우",주민등록번호 수집 법정주의 시행 이전에 수집하여 저장하고 있던 주민등록번호를 현재 법적 근거가 없음에도 파기하지 않고 보관하고 있는 경우,주민등록번호 수집의 법적 근거가 있다는 사유로 홈페이지 회원가입 단계에서 대체수단을 제공하지 아니하고 주민등록번호를 입력받는 본인확인 및 회원가입 방법만을 제공한 경우,,
83,3.1.4,장애인에 대한 요금감면 등 혜택 부여를 위해 장애여부 등 건강에 관한 민감정보를 수집하면서 다른 개인정보 항목에 포함하여 일괄 동의를 받은 경우,회원가입 시 외국인에 한해 외국인등록번호를 수집하면서 다른 개인정보 항목에 포함하여 일괄 동의를 받은 경우,민감정보 또는 고유식별정보에 대하여 별도 동의를 받으면서 고지해야 할 4가지 사항 중에 일부를 누락하거나 잘못된 내용으로 고지하는 경우 (동의 거부 권리 및 동의 거부에 따른 불이익 사항을 고지하지 않은 경우 등),,,,,,
84,3.1.5,"인터넷 홈페이지, SNS에 공개된 개인정보를 수집하고 있는 상태에서 정보주체(이용자)의 수집출처 요구에 대한 처리절차가 존재하지 않는 경우","개인정보 보호법 제17조제1항제1호에 따라 다른 사업자로부터 개인정보 제공동의를 근거로 개인정보를 제공받았으나 이에 대해 해당 정보주체에게 3개월 내에 통지하지 않은 경우(단, 제공받은 사업자가 5만명 이상 정보주체의 민감정보 또는 고유식별정보를 처리하거나 100만명 이상 정보주체의 개인정보를 처리하는 경우)",서비스 제공과 직접 관련이 없는 타겟 마케팅 목적으로 쿠키에 포함된 개인정보를 동의받지 않고 수집하는 경우,,,,,,
85,3.1.6,영상정보처리기기 안내판의 고지 문구가 일부 누락 되어 운영되고 있거나 영상정보처리기기 운영·관리 방침을 수립·운영하고 있지 않는 경우,"영상정보처리기기 운영 관리 방침을 수립 운영하고 있으나 방침의 내용과 달리 보관기간을 준수하지 않고 운영되거나, 영상정보 보호를 위한 접근통제 및 로깅 등 방침에 기술한 사항이 준수 되지 않는 등 관리가 미흡한 경우","영상정보처리기기의 설치·운영 사무를 외부업체에 위탁을 주고 있으나 영상정보의 관리현황 점검에 관한 사항, 손해배상 책임에 관한 사항 등 법령에서 요구하는 내용을 영상정보처리기기 업무 위탁 계약서에 명시하지 않은 경우",영상정보처리기기의 설치·운영 사무를 외부업체에 위탁을 주고 있으나 영상정보처리기기 안내판에 수탁자의 명칭과 연락처를 누락하여 고지한 경우,,,,,
86,3.1.7,"‘홍보 및 마케팅’ 목적으로 개인정보를 수집하면서 ‘부가서비스 제공’, ‘제휴 서비스 제공’ 등과 같이 목적을 모호하게 안내하는 경우 또는 다른 목적으로 수집하는 개인정보와 구분 하지 않고 포괄 동의를 받는 경우","모바일 앱에서 광고성 정보전송(앱푸시)에 대해 거부 의사를 밝혔으나, 프로그램 오류 등의 이유로 광고성 앱 푸시가 이루어지는 경우","온라인 회원가입 화면에서 문자, 이메일에 의한 광고성 정보 전송에 대해 디폴트로 체크되어 있는 경우",광고성 정보 수신동의 여부에 대해 매 2년 마다 확인을 하지 않은 경우,,,,,
87,3.2.1,개인정보파일을 홈페이지의 개인정보파일 등록 메뉴를 통해 목록을 관리하고 있으나 그 중 일부 홈페이지 서비스와 관련된 개인정보파일의 내용이 개인정보 처리방침에 누락되어 있는 경우,"신규 개인정보파일을 구축한지 2개월이 경과하였으나, 해당 개인정보파일을 개인정보보호위원회(구.행정안전부)에 등록하지 않은 경우",개인정보보호위원회(구.행정안전부)에 등록되어 공개된 개인정보파일의 내용(수집하는 개인정보의 항목 등)이 실제 처리하고 있는 개인정보파일 현황과 상이한 경우,,,,,,
88,3.2.2,"인터넷 홈페이지를 통해 회원정보를 변경할 때는 본인확인 절차를 거치고 있으나, 고객센터 상담원과의 통화를 통한 회원 정보 변경 시에는 본인확인 절차가 미흡하여 회원정보의 불법적인 변경이 가능한 경우","온라인 회원에 대해서는 개인정보를 변경할 수 있는 방법을 제공하고 있으나, 오프라인 회원에 대해서는 개인정보를 변경할 수 있는 방법을 제공하고 있지 않은 경우",,,,,,,
89,3.2.3,개인정보 표시제한 조치 표준이 마련되어 있지 않거나 이를 준수하지 않는 등의 사유로 동일한 개인정보 항목에 대해 개인정보처리시스템 화면 별로 서로 다른 마스킹 기준이 적용된 경우,"개인정보처리시스템의 화면 상에서는 개인정보가 마스킹되어 표시되어 있으나, 웹브라우저 소스보기를 통해 마스킹되지 않은 전체 개인정보가 노출되는 경우",개인정보 검색 화면에서 전체적으로 like 검색이 허용되어 성씨만으로도 불필요하게 과도한 개인정보가 조회되는 경우,개인정보를 동의 받은 목적을 벗어나 빅데이터 분석에 활용하기 위해 비식별 조치를 하면서 '개인정보 비식별 조치 가이드라인'에 따른 공식적인 적정성 평가 절차를 거치지 않고 내부 인원만으로 적정성 평가를 수행한 경우,,,,,
90,3.2.4,"스마트폰 앱에서 서비스에 불필요함에도 불구하고 주소록, 사진, 문자 등 스마트폰 내 개인 정보 영역에 접근할 수 있는 권한을 과도하게 설정한 경우",정보통신서비스 제공자의 스마트폰 앱에서 스마트폰 내 저장되어 있는 정보 및 설치된 기능에 접근하면서 접근권한에 대한 고지 및 동의를 받지 않고 있는 경우,스마트폰 앱의 접근권한에 대한 동의를 받으면서 선택사항에 해당하는 권한을 필수권한으로 고지하여 동의를 받는 경우,"접근권한에 대한 개별동의가 불가능한 안드로이드 6.0 미만 버전을 지원하는 스마트폰 앱을 배포하면서 선택적 접근권한을 함께 설정하여, 선택적 접근권한에 대해 거부할 수 없도록 하고 있는 경우",,,,,
91,3.2.5,상품배송을 목적으로 수집한 개인정보를 사전에 동의 받지 않은 자사 상품의 통신판매 광고에 이용한 경우,"고객 만족도 조사, 경품 행사에 응모하기 위해 수집한 개인정보를 자사의 할인판매 행사 안내용 광고 발송에 이용한 경우",공공기관이 다른 법률에 근거하여 민원인의 개인정보를 목적 외로 타 기관에 제공하면서 관련 사항을 관보 또는 인터넷 홈페이지에 게시하지 않은 경우,공공기관이 범죄 수사의 목적으로 경찰서에 개인정보를 제공하면서 ‘개인정보 목적 외 이용 및 제3자 제공 대장'에 관련 사항을 기록하지 않은 경우,,,,,
92,3.3.1,"개인정보처리자가 개인정보 제3자 제공 동의를 받을 때 정보주체에게 고지하는 사항 중에 일부 사항(동의 거부권, 제공하는 항목 등)을 누락한 경우",개인정보를 제3자에게 제공하는 과정에서 제3자 제공 동의 여부를 적절히 확인하지 못하여 동의하지 않은 정보주체(이용자)의 개인정보가 함께 제공된 경우,"개인정보를 제공 동의를 받을 때, 제공받는 자를 특정하지 않고 ""~ 등""과 같이 포괄적으로 안내하고 동의를 받은 경우","회원 가입 단계에서 선택사항으로 제3자 제공 동의를 받고 있으나, 제3자 제공에 동의하지 않으면 회원 가입 절차가 더 이상 진행되지 않도록 되어 있는 경우",제공받는 자의 이용 목적과 관련 없이 지나치게 많은 개인정보를 제공하는 경우,,,,
93,3.3.2,홈페이지 개인정보 처리방침에 개인정보 처리업무 위탁 사항을 공개하고 있으나 일부 수탁자와 위탁하는 업무의 내용이 누락된 경우,정보통신서비스 제공자이면서 정보통신서비스 제공에 관한 계약 이행과 무관한 개인정보 처리 업무를 위탁하면서 수탁자를 개인정보 처리방침에 공개하는 것으로 갈음하여 이용자 의 동의를 받지 않은 경우,정보통신서비스 제공자로부터 개인정보 처리업무를 위탁받은 수탁자가 위탁자의 승인없이 개인정보 처리업무를 재위탁 한 경우,,,,,,
94,3.3.3,정보통신서비스 제공자가 영업 양수를 통해 개인정보를 이전 받으면서 양도자가 이미 통지했다는 이유로 개인정보 이전 사실 등에 대해 이용자에게 알리지 않은 경우,개인정보처리자가 영업 양수를 통해 개인정보를 이전 받으면서 양도자가 개인정보 이전 사실을 알리지 않았음에도 개인정보 이전 사실을 정보주체에게 알리지 않은 경우,"영업 양수도 등에 의해 개인정보를 이전 받으면서 정보주체(이용자)가 이전을 원하지 않은 경우 조치할 수 있는 방법과 절차를 마련하지 않거나, 이를 정보주체(이용자)에게 알리지 않은 경우",,,,,,
95,3.3.4,개인정보를 처리하는 과정에서 해외 사업자에게 개인정보 국외 이전이 발생하였으나 이에 대한 동의를 받지 않은 경우,"정보통신서비스 제공자가 필수적인 서비스 제공을 위하여 해외 클라우드 서비스를 이용하여 개인정보 처리위탁 및 보관을 하면서 이전되는 국가, 이전 방법 등 관련 사항을 홈페이지에 공개하거나 이용자에게 알리지 않은 경우",정보통신서비스 제공자가 개인정보 국외 이전에 대한 동의를 받으면서 이전 받는 자의 명칭(업체명)만 고지하고 이전되는 국가 등에 대해 알리지 않은 경우,"정보통신서비스 제공자가 계약의 이행 및 이용자 편의 증진과 직접적인 관련이 없는 개인정보 처리업무를 위해 해외 클라우드 서비스(일본 도쿄 리전, 미국 버지니아 리전 등)를 사 용하면서 국외 이전 관련 이용자 동의를 받지 않은 경우",,,,,
96,3.4.1,"회원 탈퇴 등 목적이 달성되거나 보유기간이 경과된 경우 회원DB에서는 해당 개인정보를 파기하였으나 CRM, DW 등 연계된 개인정보처리시스템에 복제되어 저장되어 있는 개인정보를 파기하지 않은 경우",특정 기간 동안 이벤트를 하면서 수집된 개인정보에 대해 이벤트가 종료된 이후에도 파기기준이 수립되어 있지 않거나 파기가 이루어지고 있지 않은 경우,"콜센터에서 수집되는 민원처리 관련 개인정보(상담이력, 녹취 등)를 전자상거래법을 근거로 3년간 보존하고 있으나, 3년이 경과한 후에도 파기하지 않고 보관하고 있는 경우",,,,,,
97,3.4.2,탈퇴회원 정보를 파기하지 않고 전자상거래법에 따라 일정기간 보관하면서 Flag값만 변경하여 다른 회원정보와 동일한 테이블에 보관하고 있는 경우,전자상거래법에 따른 소비자 불만 및 분쟁처리에 관한 기록을 법적 의무보존 기간인 3년을 초과하여 5년간 보존하고 있는 경우,분리 DB를 구성하였으나 접근권한을 별도로 설정하지 않아 업무상 접근이 불필요한 인원도 분리 DB에 자유롭게 접근이 가능한 경우,,,,,,
98,3.4.3,개인정보 유효기간제를 적용받는 정보통신서비스 제공자가 1년 이상 서비스를 접속하지 않은 이용자의 개인정보를 지체 없이 파기 또는 분리 보관하지 않고 월단위로 파기 또는 분리보관하고 있는 경우,"1년간 홈페이지에 로그인 하지 않은 회원정보를 별도 DB에 분리 보관하였으나, 이 때 분리된 회원DB에 접근 가능한 관리자를 최소인원으로 제한하지 않고 기존에 고객DB의 조회 권한이 부여된 개발자, 운영자 모두가 분리된 회원DB에서 고객정보 조회가 가능한 경우","휴면 이용자의 재이용 요청에 대비하여 회원 DB에 일부 정보를 남겨두면서 이름, 연락처 등 과도한 정보를 저장하고 있는 경우",,,,,,
99,3.5.1,"개인정보 처리방침에 공개되어 있는 개인정보 수집, 제3자 제공 내역이 실제 수집 및 제공하는 내역과 다른 경우","개인정보 보호책임자의 변경, 수탁자 변경 등 개인정보 처리방침 공개 내용 중에 변경사항이 발생하였음에도 이를 반영하여 변경하지 않은 경우","개인정보 처리방침이 공개는 되어 있으나, 명칭이 '개인정보 처리방침이 아니라 ‘개인정보보호정책’으로 되어 있고 글자 크기, 색상 등을 활용하여 정보주체(이용자)가 쉽게 찾을 수 있도록 되어 있지 않은 경우",개인정보 처리방침이 수차례 개정되었으나 예전에 작성된 개인정보 처리방침의 내용을 확인할 수 있도록 공개되어 있지 않은 경우,,,,,
100,3.5.2,"개인정보의 열람, 정정·삭제, 처리정지 요구 방법을 정보주체가 알 수 있도록 공개하지 않은 경우",개인정보의 열람 요구에 대하여 정당한 사유의 통지 없이 열람 요구를 접수받은 날로부터 10일을 초과하여 회신하고 있는 경우,개인정보의 열람 민원에 대한 처리 내역 기록 및 보관이 이루어지지 않은 경우,정보주체 당사자 또는 정당한 대리인이 맞는지에 대한 확인 절차 없이 열람 통지가 이루어 지는 경우,개인정보의 정정·삭제 요구에 대하여 정정·삭제 요구를 접수받은 날로부터 10일을 초과 하여 회신하는 경우,"회원 가입 시에는 온라인을 통해 쉽게 회원 가입이 가능하였으나, 회원 탈퇴 시에는 신분증 등 추가 서류를 제출하게 하거나 오프라인 방문을 통해서만 가능하도록 하는 경우",,,
101,3.5.3,"전년도 정보통신서비스 부문 매출액이 100억원 이상이었으나, 금년도에 개인정보 이용내역을 통지하지 않은 경우",개인정보 이용내역을 개별 이용자에게 직접적으로 통지하는 대신 홈페이지에서 팝업창이나 별도 공지사항으로 안내만 한 경우,,,,,,,